Item Title,Publication Title,Book Series Title,Journal Volume,Journal Issue,Item DOI,Authors,Publication Year,URL,Content Type
Exploring automated machine learning to develop facial expression recognition systems,Discover Applied Sciences,,,,10.1007/s42452-025-07728-1,Atharv GoelPraneet SaurabhDhananjay BisenRishav DubeyPrathap Somu,2025,https://link.springer.com/article/10.1007/s42452-025-07728-1,Article
"A systematic review of generative AI: importance of industry and startup-centered perspectives, agentic AI, ethical considerations &amp; challenges, and future directions",Artificial Intelligence Review,,,,10.1007/s10462-025-11435-z,Kinjal PatelMilind ShahKarishma M. QureshiMohamed Rafik N. Qureshi,2025,https://link.springer.com/article/10.1007/s10462-025-11435-z,Article
Towards trustworthy AI in cultural heritage,npj Heritage Science,,,,10.1038/s40494-026-02403-z,Marina PaolantiEmanuele FrontoniRoberto Pierdicca,2026,https://www.nature.com/articles/s40494-026-02403-z,Article
"Fairness-preserving framework for machine learning: data bias quantification, model evaluation, and robustness across multiple datasets",AI and Ethics,,,,10.1007/s43681-025-00874-7,Shahadat UddinHaohui LuFarshid Hajati,2025,https://link.springer.com/article/10.1007/s43681-025-00874-7,Article
Large language models for mental health diagnosis and treatment: a survey,Artificial Intelligence Review,,,,10.1007/s10462-025-11418-0,Mohsen GhorbianMostafa Ghobaei-Arani,2025,https://link.springer.com/article/10.1007/s10462-025-11418-0,Article
Optimized artificial neural networks for breast cancer diagnosis prediction,Discover Applied Sciences,,,,10.1007/s42452-025-07727-2,Surbhi GuptaSaurabh Sharma,2025,https://link.springer.com/article/10.1007/s42452-025-07727-2,Article
Data stewardship and curation practices in AI-based genomics and automated microscopy image analysis for high-throughput screening studies: promoting robust and ethical AI applications,Human Genomics,,,,10.1186/s40246-025-00716-x,Asefa Adimasu TaddeseAssefa Chekole AddisBjorn T. Tam,2025,https://link.springer.com/article/10.1186/s40246-025-00716-x,Article
Health Care for All: Combating Bias in Generative AI for Fair Medical Outcomes,Advances and Challenges of Applying AI/GenAI in Design and Process Science,,,,10.1007/978-3-031-96518-0_2,Khaled ELKarazleValliappan RamanCaslon ChuaPatrick Hang Hui Then,2025,https://link.springer.com/chapter/10.1007/978-3-031-96518-0_2,Conference paper
Methodological Insights into Stress Detection and Prediction: A Focused Review on Women-Specific Approaches,Advances in Emerging Technologies and Computing Innovations,,,,10.1007/978-3-031-92854-3_48,Madhuri Vishnu MalodeSivaram Ponnusamy,2025,https://link.springer.com/chapter/10.1007/978-3-031-92854-3_48,Conference paper
A comprehensive review on financial explainable AI,Artificial Intelligence Review,,,,10.1007/s10462-024-11077-7,Wei Jie YeoWihan Van Der HeeverRui MaoErik CambriaRanjan SatapathyGianmarco Mengaldo,2025,https://link.springer.com/article/10.1007/s10462-024-11077-7,Article
The Ethics of Artificial Intelligence for Intelligence Analysis: a Review of the Key Challenges with Recommendations,Digital Society,,,,10.1007/s44206-023-00036-4,Alexander BlanchardMariarosaria Taddeo,2023,https://link.springer.com/article/10.1007/s44206-023-00036-4,Article
A Comprehensive Review of Multimodal Large Language Models for Medical Imaging and Omics Data,Archives of Computational Methods in Engineering,,,,10.1007/s11831-026-10504-y,Raja Vavekanand,2026,https://link.springer.com/article/10.1007/s11831-026-10504-y,Article
Health equity innovation in precision medicine: data stewardship and agency to expand representation in clinicogenomics,Health Research Policy and Systems,,,,10.1186/s12961-024-01258-9,Patrick J. SilvaVasiliki RahimzadehReid PowellJunaid HusainScott GrossmanAdam HansenJennifer HinkelRafael RosengartenMarcia G. OryKenneth S. Ramos,2024,https://link.springer.com/article/10.1186/s12961-024-01258-9,Article
A decomposition of Fisher’s information to inform sample size for developing or updating fair and precise clinical prediction models — part 2: time-to-event outcomes,Diagnostic and Prognostic Research,,,,10.1186/s41512-025-00204-9,Richard D. RileyGary S. CollinsLucinda ArcherRebecca WhittleAmardeep LeghaLaura KirtonPaula DhimanMohsen SadatsafaviNicola J. AdderleyJoseph AldermanGlen P. MartinJoie Ensor,2025,https://link.springer.com/article/10.1186/s41512-025-00204-9,Article
Early detection of mental health conditions using multimodal generative AI with MI-GBF and fusion-three branch network,International Journal of Information Technology,,,,10.1007/s41870-025-03042-6,Amit Kumar SaxenaRajeshwar PrasadSuman Laha,2025,https://link.springer.com/article/10.1007/s41870-025-03042-6,Article
Enhanced Facial Emotion Recognition and Age Estimation Using Modified Residual Network and Support Vector Machine,International Journal of Computational Intelligence Systems,,,,10.1007/s44196-025-00966-6,Noha A. El-HagWalid El-ShafaiFathi E. Abd El-SamieNaglaa F. Soliman,2025,https://link.springer.com/article/10.1007/s44196-025-00966-6,Article
Ethical and equitable approaches in AI for vector-borne disease management,AI and Ethics,,,,10.1007/s43681-025-00933-z,Jessica J. WilliamsIoanna AngelidouMaria CholviPerparim KadriajAngeliki F. MartinouNadejda MocreacSong-Quan OngFerhat SadakJiří SkuhrovecEnkelejda VeloBranimir K. Hackenberger,2025,https://link.springer.com/article/10.1007/s43681-025-00933-z,Article
Enhancing workplace productivity with secure AI using federated contrastive learning model for performance optimization,Scientific Reports,,,,10.1038/s41598-025-25153-7,G. MayaA. Suganya,2025,https://link.springer.com/article/10.1038/s41598-025-25153-7,Article
Ethical and Equitable Data Science: Bridging Social Justice and Technical Innovation ADBIS 2025 Doctoral Consortium Lecture,New Trends in Database and Information Systems,,,,10.1007/978-3-032-05727-3_20,Genoveva Vargas-Solar,2026,https://link.springer.com/chapter/10.1007/978-3-032-05727-3_20,Conference paper
"Advanced nanotheranostic approaches for targeted glioblastoma treatment: a synergistic fusion of CRISPR-Cas gene editing, AI-driven tumor profiling, and&#xa0;BBB-modulation",Medical Oncology,,,,10.1007/s12032-025-02944-6,Chethan PatilR. PriyankaB. M. HarshithaS. OshikS. YashwanthB. R. DarshanShradha PatilK. A. PrajwalPrasiddhi NaikPrakash GoudanavarT. Mallamma,2025,https://link.springer.com/article/10.1007/s12032-025-02944-6,Article
AI-based recognition of facial and micro-expressions for the diagnosis of mental and neurological disorders: a systematic review,BMC Psychiatry,,,,10.1186/s12888-025-07739-7,Sara Ghafarfaraji,2025,https://link.springer.com/article/10.1186/s12888-025-07739-7,Article
Applications of machine learning for computer-aided diagnosis of Parkinson’s disease: progress and benchmark case study,Artificial Intelligence Review,,,,10.1007/s10462-025-11347-y,Juntao ZhangYiming ZhangYing WengAkram A. HosseiniBoding WangTom DeningWeinyu FanWeizhong Xiao,2025,https://link.springer.com/article/10.1007/s10462-025-11347-y,Article
A Systematic Survey on Bias and Fairness in Machine Learning,Data Science and Security,,,,10.1007/978-981-96-4883-2_8,Kapil TiwariNirmalya SarkarKritica BishtSamiksha Shukla,2025,https://link.springer.com/chapter/10.1007/978-981-96-4883-2_8,Conference paper
Neural networks for epilepsy detection and prediction with EEG signals: a systematic review,Artificial Intelligence Review,,,,10.1007/s10462-025-11441-1,Youpeng WuLun LuAo XuYinan WangZhiwei LiZhuanyi YangLingli ZengQingjiang Li,2025,https://link.springer.com/article/10.1007/s10462-025-11441-1,Article
"Upskilling the Old, a Quarter Century on: Media Literacies, AI and Older People in Public Policy Discourses",Human Aspects of IT for the Aged Population,,,,10.1007/978-3-031-92712-6_14,Maria SourbatiJustyna Stypińska,2025,https://link.springer.com/chapter/10.1007/978-3-031-92712-6_14,Conference paper
Bibliometric analysis and review of AI-based video generation: research dynamics and application trends (2020–2025),Discover Computing,,,,10.1007/s10791-025-09628-9,Wei XieAnshu HuQing XieJunjie ChenRuoyu WanYuhan Liu,2025,https://link.springer.com/article/10.1007/s10791-025-09628-9,Article
"Face-based machine learning diagnostics: applications, challenges and opportunities",Artificial Intelligence Review,,,,10.1007/s10462-025-11246-2,Jie SongMengqiao HeXin ZhengYuxin ZhangCheng BiJinhua FengJiale DuHang LiBairong Shen,2025,https://link.springer.com/article/10.1007/s10462-025-11246-2,Article
"A comprehensive review of LLM applications for lung cancer diagnosis and treatment: classification, challenges, and future directions",Journal of Big Data,,,,10.1186/s40537-025-01304-5,Mohsen GhorbianMostafa Ghobaei-Arani,2025,https://link.springer.com/article/10.1186/s40537-025-01304-5,Article
A Two-Stage Hybrid Preprocessing Framework for Improving Machine Learning-Based Gestational Diabetes Prediction,Artificial Intelligence Based Smart and Secured Applications,,,,10.1007/978-3-032-17840-4_15,Thejaswi NandyalaK. Baalaji,2026,https://link.springer.com/chapter/10.1007/978-3-032-17840-4_15,Conference paper
Fairness-Adaptive Classification Trees,Methodological and Applied Statistics and Demography IV,,,,10.1007/978-3-031-64447-4_109,Anna GottardSabrina GiordanoVanessa Verrina,2025,https://link.springer.com/chapter/10.1007/978-3-031-64447-4_109,Conference paper
Virtual histopathology methods in medical imaging - a systematic review,BMC Medical Imaging,,,,10.1186/s12880-024-01498-9,Muhammad Talha ImranImran ShafiJamil AhmadMuhammad Fasih Uddin ButtSantos Gracia VillarEduardo Garcia VillenaTahir KhurshaidImran Ashraf,2024,https://link.springer.com/article/10.1186/s12880-024-01498-9,Article
Selected Abstracts from the SIIM 2025 Annual Meeting of the Society for Imaging Informatics in Medicine (SIIM),Journal of Imaging Informatics in Medicine,,,,10.1007/s10278-025-01501-x,,2025,https://link.springer.com/article/10.1007/s10278-025-01501-x,Article
AI-Driven Digital Transformation: Enhancing Competitiveness and Sustainability in the Modern Business Landscape,Competitiveness and Sustainability in the Digitization Era,,,,10.1007/978-3-031-91778-3_12,Vaikunta Pai TB. Sunil KamathVirgil PopescuRamona Birau,2025,https://link.springer.com/chapter/10.1007/978-3-031-91778-3_12,Conference paper
Novel Method for&#xa0;ICG Data Augmentation By Using Noise-Based Approach,Artificial Intelligence and Soft Computing,,,,10.1007/978-3-032-03711-4_18,Paulina BrzęczekIlona KarpielRafał Grycuk,2026,https://link.springer.com/chapter/10.1007/978-3-032-03711-4_18,Conference paper
Eu regulatory ecosystem for ethical AI,AI and Ethics,,,,10.1007/s43681-025-00749-x,Vaios BolgourasApostolis ZarrasChristian LekaIoannis StylianouAristeidis FaraoChristos Xenakis,2025,https://link.springer.com/article/10.1007/s43681-025-00749-x,Article
Investigating Sources and Effects of Bias in AI-Based Systems – Results from an MLR,"Systems, Software and Services Process Improvement",,,,10.1007/978-3-031-42307-9_2,Caoimhe De BuitlearAilbhe ByrneEric McEvoyAbasse CamaraMurat YilmazAndrew McCarrenPaul M. Clarke,2023,https://link.springer.com/chapter/10.1007/978-3-031-42307-9_2,Conference paper
A mini-approach for retail banking with transparent recommendation system enabled by explainable AI,Discover Artificial Intelligence,,,,10.1007/s44163-025-00817-5,Palash BairagiShrey Arora,2026,https://link.springer.com/article/10.1007/s44163-025-00817-5,Article
Advances in machine learning for keratoconus diagnosis,International Ophthalmology,,,,10.1007/s10792-025-03496-4,Zahra J. MuhsinRami QahwajiIbrahim GhafirMo’ath AlShawabkehMuawyah Al BdourSaif AlRyalatMajid Al-Taee,2025,https://link.springer.com/article/10.1007/s10792-025-03496-4,Article
A novel Pulp Caries GAN multi loss GAN with new pulp inspired metaheuristics for pediatric dental caries detection and segmentation,Scientific Reports,,,,10.1038/s41598-025-28459-8,Amira Abdelhafeez ElkhatibMostafa ElbazRiham Sobhy SolimanMona Elshirbini Hafez,2026,https://link.springer.com/article/10.1038/s41598-025-28459-8,Article
"Engineering Risk-Aware, Security-By-Design Frameworks for Assurance of Large-Scale Autonomous AI Models","Proceedings of the Future Technologies Conference (FTC) 2025, Volume 2",,,,10.1007/978-3-032-07989-3_14,Krti Tallam,2026,https://link.springer.com/chapter/10.1007/978-3-032-07989-3_14,Conference paper
Transforming Cognition and Human Society in the Digital Age,Biological Theory,,,,10.1007/s13752-024-00483-3,Igor Farkaš,2024,https://link.springer.com/article/10.1007/s13752-024-00483-3,Article
Beyond REMS &amp; PDMPs: A Proposed Framework for Next-Generation Opioid Regulation,Therapeutic Innovation & Regulatory Science,,,,10.1007/s43441-025-00882-z,Aysha RanaKavetha Ram,2025,https://link.springer.com/article/10.1007/s43441-025-00882-z,Article
Survey of AI-driven techniques for ovarian cancer detection: state-of-the-art methods and open challenges,Network Modeling Analysis in Health Informatics and Bioinformatics,,,,10.1007/s13721-024-00491-0,Samridhi SinghMalti Kumari MauryaNagendra Pratap SinghRajeev Kumar,2024,https://link.springer.com/article/10.1007/s13721-024-00491-0,Article
A Novel Framework for Human Chronic Disease Prediction Using CNN and Adaptive Dragon Fly Optimization (ADFO) Algorithm,SN Computer Science,,,,10.1007/s42979-025-03842-4,B. RaguS. Perumal,2025,https://link.springer.com/article/10.1007/s42979-025-03842-4,Article
Bridging Bytes and Behaviors: Human-Centric Research in Emerging Digital Economies,Empowering Digital Transformation,,,,10.1007/978-3-031-96930-0_4,Nicos Rossides,2025,https://link.springer.com/chapter/10.1007/978-3-031-96930-0_4,Conference paper
Neuro-symbolic synergy in education: a survey of LLM-knowledge graph integration for explainable reasoning and emotion-aware student support,Smart Learning Environments,,,,10.1186/s40561-025-00423-z,Nour El Houda Ben ChaabeneHamza Hammami,2026,https://link.springer.com/article/10.1186/s40561-025-00423-z,Article
SafeGen: safeguarding privacy and fairness through a genetic method,Machine Learning,,,,10.1007/s10994-025-06835-9,Martina CinquiniMarta Marchiori ManerbaFederico MazzoniFrancesca PratesiRiccardo Guidotti,2025,https://link.springer.com/article/10.1007/s10994-025-06835-9,Article
Optimization of potential targets for antidepressant Chinese medicines: AI and multi-omics methods,Chinese Medicine,,,,10.1186/s13020-025-01320-w,Chaofang LeiZhigang ChenChongyang MaLe XieDahua WuJianbei ChenJiaxu Chen,2026,https://link.springer.com/article/10.1186/s13020-025-01320-w,Article
The Interaction of AI and Early Childhood Education. A State-of-the-art Review 2020–2024,Early Childhood Education Journal,,,,10.1007/s10643-025-02079-3,Lukas Ljungcrantz,2026,https://link.springer.com/article/10.1007/s10643-025-02079-3,Article
Global soft biometrics in surveillance: benchmark in the field &amp; open challenges,Multimedia Tools and Applications,,,,10.1007/s11042-026-21204-x,Bilal HassanHasti SoudbakhshSamaneh BahramiSonjoy Ranjan DasPreeti PatelAmanullah YasinUsman Khan,2026,https://link.springer.com/article/10.1007/s11042-026-21204-x,Article
Learning to represent causality in recommender systems driven by large language models (LLMs),Discover Applied Sciences,,,,10.1007/s42452-025-07551-8,Serge Stéphane AmanTiemoman KoneBehou Gerald N’guessanKouadio Prosper Kimou,2025,https://link.springer.com/article/10.1007/s42452-025-07551-8,Article
Computational whole-body-exposome models for global precision brain health,Nature Communications,,,,10.1038/s41467-025-67448-3,Agustín IbáñezClaudia Duran-AniotzJoaquín MigeotSandra BáezSol FittipaldiCarlos Coronel-OliverosHarris A. EyreChinedu Udeh-MomohHenrik ZetterbergSuvarna AlladiCarmen SandiIan H. RobertsonSanne FranzenTemitope FarombiJanitza L. Montalvo OrtizSudha SeshadriFelipe CourtPedro Valdes-SosaJiayuan XuChunshui YuLea GrinbergBrian LawlorPerminder S. SachdevKristine YaffeVladimir HachinskiKarl FristonEnzo TagliazucchiHernando Santamaría-García,2025,https://link.springer.com/article/10.1038/s41467-025-67448-3,Article
Applications of GAN Models in Breast Cancer Detection: A Comprehensive Review,Archives of Computational Methods in Engineering,,,,10.1007/s11831-025-10323-7,Jafar MajidpourHunar A. AhmedMohammed H. AhmedShayan I. JalalHossein Arabi,2025,https://link.springer.com/article/10.1007/s11831-025-10323-7,Article
NeuroDigital Interfaces and Adaptive Cognitive Networking: Towards a Human-AI Telepathic Framework,Telematics and Computing,,,,10.1007/978-3-032-09735-4_6,Emmett VitruviousFernando May Fuentes,2026,https://link.springer.com/chapter/10.1007/978-3-032-09735-4_6,Conference paper
Mapping the research landscape of agentic AI in SMMEs through a bibliometric analysis of patterns and knowledge gaps,Discover Artificial Intelligence,,,,10.1007/s44163-025-00764-1,Peter Adebowale OlujimiPius Adewale OwolawiAgnieta PretoriusEtienne Van Wyk,2025,https://link.springer.com/article/10.1007/s44163-025-00764-1,Article
From classical machine learning to emerging foundation models: review on multimodal data integration for cancer research,Artificial Intelligence Review,,,,10.1007/s10462-026-11522-9,Amgad MuneerMuhammad WaqasMaliazurina B. SaadEman ShowkatianRukhmini BandyopadhyayHui XuWentao LiJoe Y. ChangZhongxing LiaoCara HaymakerLuisa Solis SotoCarol C. WuNatalie I. VokesXiuning LeLauren A. ByersDon L. GibbonsJohn V. HeymachJianjun ZhangJia Wu,2026,https://link.springer.com/article/10.1007/s10462-026-11522-9,Article
A global perspective on data powering responsible AI solutions in health applications,AI and Ethics,,,,10.1007/s43681-023-00302-8,Jessica RuddClaudia Igbrude,2023,https://link.springer.com/article/10.1007/s43681-023-00302-8,Article
Recent Advances in Computational and Machine-Learning Approaches for Alzheimer’s Disease Classification: A Comprehensive Review,Archives of Computational Methods in Engineering,,,,10.1007/s11831-025-10476-5,Mahsa MoravejiNajme Mansouri,2025,https://link.springer.com/article/10.1007/s11831-025-10476-5,Article
Overview of the TalentCLEF 2025: Skill and&#xa0;Job Title Intelligence for&#xa0;Human Capital Management,"Experimental IR Meets Multilinguality, Multimodality, and Interaction",,,,10.1007/978-3-032-04354-2_24,Luis GascoHermenegildo FabregatLaura García-SardiñaPaula EstrellaDaniel DenizAlvaro RodrigoRabih Zbib,2026,https://link.springer.com/chapter/10.1007/978-3-032-04354-2_24,Conference paper
Reliability-improved machine learning model using knowledge-embedded learning approach for smart manufacturing,Journal of Intelligent Manufacturing,,,,10.1007/s10845-024-02482-4,Farzam FarbizSaurabh AggarwalTomasz Karol MaszczykMohamed Salahuddin HabibullahBrahim Hamadicharef,2024,https://link.springer.com/article/10.1007/s10845-024-02482-4,Article
From image classification to segmentation: a comprehensive empirical review,Iran Journal of Computer Science,,,,10.1007/s42044-025-00242-y,RuksanaJamin Rahman JimMd Jonair HossainAritra DasMd Mohsin KabirM. F. Mridha,2025,https://link.springer.com/article/10.1007/s42044-025-00242-y,Article
Factors influencing human trust in intelligent built environment systems,AI and Ethics,,,,10.1007/s43681-025-00813-6,Amir BehzadanArmita Dabiri,2025,https://link.springer.com/article/10.1007/s43681-025-00813-6,Article
A survey on generative nonverbal facial behavior for highly realistic embodied agents,Intelligent Service Robotics,,,,10.1007/s11370-025-00674-2,Tri Tung Nguyen NguyenQuang Tien DamDinh Tuan TranJoo-Ho Lee,2026,https://link.springer.com/article/10.1007/s11370-025-00674-2,Article
A survey of the state of the art in conversational question answering systems,Knowledge and Information Systems,,,,10.1007/s10115-025-02620-1,Manoj Madushanka PereraAdnan MahmoodKasun Eranda WijethilakeFahmida IslamMaryam TahermazandaraniQuan Z. Sheng,2025,https://link.springer.com/article/10.1007/s10115-025-02620-1,Article
Data collection and quality challenges in deep learning: a data-centric AI perspective,The VLDB Journal,,,,10.1007/s00778-022-00775-9,Steven Euijong WhangYuji RohHwanjun SongJae-Gil Lee,2023,https://link.springer.com/article/10.1007/s00778-022-00775-9,Article
Boosting Automatic Speech Recognition Performance for&#xa0;Noisy Emergency Calls with&#xa0;Hybrid Processing Techniques,Information and Communication Technologies,,,,10.1007/978-3-032-08366-1_7,Jorge Luis Zambrano-MartinezPatricio Santiago García-MonteroMarcos Orellana,2026,https://link.springer.com/chapter/10.1007/978-3-032-08366-1_7,Conference paper
A Comprehensive Review of AI-Driven Arrhythmia Detection: From Classical Machine Learning to Quantum Machine Learning With ECG and PPG Signals,Archives of Computational Methods in Engineering,,,,10.1007/s11831-026-10539-1,Shankar Sachin NimmagantiVishnu Vardhana Reddy Karna,2026,https://link.springer.com/article/10.1007/s11831-026-10539-1,Article
"A comprehensive survey on pose estimation and tracking in sports: methodologies, datasets, challenges, and future directions",Artificial Intelligence Review,,,,10.1007/s10462-025-11344-1,Mustafa Hikmet Bilgehan UçarSerdar SolakAli Olow JimaleHakan ÜnalSüleyman Eken,2025,https://link.springer.com/article/10.1007/s10462-025-11344-1,Article
Improving operations through a lean AI paradigm: a view to an AI-aided lean manufacturing via versatile convolutional neural network,The International Journal of Advanced Manufacturing Technology,,,,10.1007/s00170-024-13874-4,Mohammad ShahinMazdak MaghanakiAli HosseinzadehF. Frank Chen,2024,https://link.springer.com/article/10.1007/s00170-024-13874-4,Article
"Generative AI for cyber threat intelligence: applications, challenges, and analysis of real-world case studies",Artificial Intelligence Review,,,,10.1007/s10462-025-11338-z,Prasasthy BalasubramanianSonali LiyanaHamsini SankaranShambavi SivaramakrishnanSruthi PusuluriSusanna PirttikangasElla Peltonen,2025,https://link.springer.com/article/10.1007/s10462-025-11338-z,Article
"Generative AI in depth: A survey of recent advances, model variants, and real-world applications",Journal of Big Data,,,,10.1186/s40537-025-01247-x,Shamim YazdaniAkansha SinghNripsuta SaxenaZichong WangAvash PalikheDeng PanUmapada PalJie YangWenbin Zhang,2025,https://link.springer.com/article/10.1186/s40537-025-01247-x,Article
What do academics say about artificial intelligence ethics? An overview of the scholarship,AI and Ethics,,,,10.1007/s43681-022-00182-4,Onur Bakiner,2022,https://link.springer.com/article/10.1007/s43681-022-00182-4,Article
Interfacing Human Brains: What Could Go Wrong?,Privacy Technologies and Policy,,,,10.1007/978-3-032-07574-1_4,Marta Beltrán,2026,https://link.springer.com/chapter/10.1007/978-3-032-07574-1_4,Conference paper
Benchmarking action recognition models for self-harm detection in studio and real-world datasets,Scientific Reports,,,,10.1038/s41598-026-36999-w,Kanghee LeeDoohee LeeHyun-Sik HamHee-Cheol KimYourack LeeHyun-Ghang JeongHyun-Soo Choi,2026,https://link.springer.com/article/10.1038/s41598-026-36999-w,Article
EU Guideline on AI Trustworthy and ‘Not Intuitive’ Application of the Principle of Fairness,"Rule of Law, Technology and Environment",,,,10.1007/978-3-031-76349-6_11,Valentina Colcelli,2025,https://link.springer.com/chapter/10.1007/978-3-031-76349-6_11,Conference paper
Comprehensive Review of End-to-End Dependency Parsing with Auto-regressive Large Language Models,Advanced Computing and Communications: Responsible AI,,,,10.1007/978-3-031-96473-2_22,Nagarchi Arshad AliK. Ramalakshmi,2025,https://link.springer.com/chapter/10.1007/978-3-031-96473-2_22,Conference paper
Enhancing sparse data recommendations with self-inspected adaptive SMOTE and hybrid neural networks,Scientific Reports,,,,10.1038/s41598-025-02593-9,Ramesh VatambetiHari Prasad GandikotaD. SiriG. SatyanarayanaNarasimhula BalayesuM. Ganesh KarthikKoteswararao Ch,2025,https://link.springer.com/article/10.1038/s41598-025-02593-9,Article
"Data Augmentation Using Large Language Models: Methods, Challenges, and&#xa0;Perspectives",Emerging Challenges in Intelligent Management Information Systems,,,,10.1007/978-3-032-13869-9_5,Agata KozinaMichał PikusJarosław Wąs,2026,https://link.springer.com/chapter/10.1007/978-3-032-13869-9_5,Conference paper
User Response Modeling in Recommender Systems: A Survey,Journal of Mathematical Sciences,,,,10.1007/s10958-024-07431-3,M. ShirokikhI. ShenbinA. AlekseevA. VolodkevichA. VasilevS. Nikolenko,2024,https://link.springer.com/article/10.1007/s10958-024-07431-3,Article
Advanced predictive disease modeling in biomedical IoT using the temporal adaptive neural evolutionary algorithm,Scientific Reports,,,,10.1038/s41598-025-08426-z,Chandragandhi SArvind CSrihari K,2025,https://link.springer.com/article/10.1038/s41598-025-08426-z,Article
Addressing diversity in hiring procedures: a generative adversarial network approach,AI and Ethics,,,,10.1007/s43681-024-00445-2,Tales MarraEmeric Kubiak,2024,https://link.springer.com/article/10.1007/s43681-024-00445-2,Article
Learning from data with structured missingness,Nature Machine Intelligence,,,,10.1038/s42256-022-00596-z,Robin MitraSarah F. McGoughTapabrata ChakrabortiChris HolmesRyan CoppingNiels HagenbuchStefanie BiedermannJack NoonanBrieuc LehmannAditi ShenviXuan Vinh DoanDavid LeslieGinestra BianconiRuben Sanchez-GarciaAlisha DaviesMaxine MackintoshEleni-Rosalina AndrinopoulouAnahid BasiriChris HarbronBen D. MacArthur,2023,https://link.springer.com/article/10.1038/s42256-022-00596-z,Article
