Item Title,Publication Title,Book Series Title,Journal Volume,Journal Issue,Item DOI,Authors,Publication Year,URL,Content Type
Artificial Intelligence in Food Manufacturing: A Review of Current Work and Future Opportunities,Food Engineering Reviews,,,,10.1007/s12393-024-09395-1,Mert CanatanNasser AlkhulaifiNicholas WatsonZiynet Boz,2025,https://link.springer.com/article/10.1007/s12393-024-09395-1,Article
Operationalising ethics in artificial intelligence for healthcare: a framework for AI developers,AI and Ethics,,,,10.1007/s43681-022-00195-z,Pravik SolankiJohn GrundyWaqar Hussain,2022,https://link.springer.com/article/10.1007/s43681-022-00195-z,Article
The current status and prospects of large language models in medical application and research,Chinese Journal of Academic Radiology,,,,10.1007/s42058-024-00164-x,Heng DengQian ZhouZiwei ZhangTaohu ZhouXiaoqing LinYi XiaLi FanShiyuan Liu,2024,https://link.springer.com/article/10.1007/s42058-024-00164-x,Article
The role of deep learning-based algorithms in retinal image processing: a review,Multimedia Tools and Applications,,,,10.1007/s11042-026-21181-1,Canan Celikİbrahim Yücedağ,2026,https://link.springer.com/article/10.1007/s11042-026-21181-1,Article
Comparative Analysis of Real and AI-Generated Synthetic Images for Classification Tasks: A Deep Learning Approach,Innovations in Data Analytics,,,,10.1007/978-981-96-6300-2_8,Hussain Falih MahdiAyan SarTanupriya ChoudhurySumit AichPurvika Joshi,2025,https://link.springer.com/chapter/10.1007/978-981-96-6300-2_8,Conference paper
Deep learning approaches to detect breast cancer: a comprehensive review,Multimedia Tools and Applications,,,,10.1007/s11042-024-20011-6,Amir Mohammad SharafaddiniKiana Kouhpah EsfahaniNajme Mansouri,2024,https://link.springer.com/article/10.1007/s11042-024-20011-6,Article
Artificial intelligence (AI)—it’s the end of the tox as we know it (and I feel fine)*,Archives of Toxicology,,,,10.1007/s00204-023-03666-2,Nicole KleinstreuerThomas Hartung,2024,https://link.springer.com/article/10.1007/s00204-023-03666-2,Article
Safeguarding Privacy of&#xa0;Sensitive E-health Data Against AI Predictive Algorithm Threats,Proceedings of Tenth International Congress on Information and Communication Technology,,,,10.1007/978-981-96-6432-0_21,Abdellah TahenniAbdelkader Belkhir,2025,https://link.springer.com/chapter/10.1007/978-981-96-6432-0_21,Conference paper
Data-driven medical devices and the EU MDR: mapping gaps in standards for regulatory compliance,npj Health Systems,,,,10.1038/s44401-026-00075-2,Ugur Ilker AtmacaSaif Ul IslamGregory EpiphaniouAnita KhadkaStuart HarrisonNikolaos MatragkasScott HansenRance DeLongCarsten Maple,2026,https://www.nature.com/articles/s44401-026-00075-2,Article
Deep learning techniques for enhanced security and privacy in 6G terrestrial–nonterrestrial network architecture,The Journal of Supercomputing,,,,10.1007/s11227-025-07097-x,Maira KhalidJehad AliAhmed Raza MohsinByeong-hee RohMohammed J. F. Alenazi,2025,https://link.springer.com/article/10.1007/s11227-025-07097-x,Article
"Smart Contact Lenses for Non-invasive Medical Diagnostics: Materials, Mechanisms, and Future Clinical Integration",Biomedical Materials & Devices,,,,10.1007/s44174-025-00616-7,Saraswati Patel,2025,https://link.springer.com/article/10.1007/s44174-025-00616-7,Article
"Unraveling the Regimes of Synthetic Data Metrics: Expectations, Ethics, and Politics",Digital Society,,,,10.1007/s44206-025-00200-y,Louis RavnVassilis GalanosMatthew ArcherDanielle Shanley,2025,https://link.springer.com/article/10.1007/s44206-025-00200-y,Article
Towards equitable AI in oncology,Nature Reviews Clinical Oncology,,,,10.1038/s41571-024-00909-8,Vidya Sankar ViswanathanVani ParmarAnant Madabhushi,2024,https://link.springer.com/article/10.1038/s41571-024-00909-8,Article
Deep learning-based joint analysis of diabetic retinopathy and glaucoma in retinal fundus images,Scientific Reports,,,,10.1038/s41598-025-32991-y,T. GeethaC. Hema,2025,https://link.springer.com/article/10.1038/s41598-025-32991-y,Article
"A review of deep learning-based localization, mapping and 3D reconstruction for endoscopy",Journal of Micro and Bio Robotics,,,,10.1007/s12213-024-00181-0,Jiawei ZhongHongliang RenQin ChenHui Zhang,2024,https://link.springer.com/article/10.1007/s12213-024-00181-0,Article
Systematic Review on Generative AI Using IoMT in Health Care: Issues Challenges and Solutions,Proceedings of Data Analytics and Management,,,,10.1007/978-981-96-3361-6_32,Arpita MittalIshan BudhirajaGitika Sharma,2025,https://link.springer.com/chapter/10.1007/978-981-96-3361-6_32,Conference paper
Responsible AI in medical aesthetics: a critical review of facial and skin analysis applications and ethical considerations,AI and Ethics,,,,10.1007/s43681-025-00887-2,Pyn Lim,2025,https://link.springer.com/article/10.1007/s43681-025-00887-2,Article
The algorithm will see you now: how AI evaluates neurosurgeons,AI and Ethics,,,,10.1007/s43681-025-00860-z,Daniel SchneiderEthan Devin Lockwood BrownMax WardBarnabas Obeng-GyasiDaniel SciubbaSheng-Fu Lo,2025,https://link.springer.com/article/10.1007/s43681-025-00860-z,Article
Fairness-Aware Data Augmentation for&#xa0;Cardiac MRI Using Text-Conditioned Diffusion Models,Fairness of AI in Medical Imaging,,,,10.1007/978-3-032-05870-6_7,Grzegorz SkorupkoRichard OsualaZuzanna SzafranowskaKaisar KushibarVien Ngoc DangNay AungSteffen E. PetersenKarim LekadirPolyxeni Gkontra,2026,https://link.springer.com/chapter/10.1007/978-3-032-05870-6_7,Conference paper
"Applications of deep learning in Alzheimer’s disease: a systematic literature review of current trends, methodologies, challenges, innovations, and future directions",Artificial Intelligence Review,,,,10.1007/s10462-024-11041-5,Shiva ToumajArash HeidariReza ShahhosseiniNima Jafari Navimipour,2024,https://link.springer.com/article/10.1007/s10462-024-11041-5,Article
Applying analytics to sociodemographic disparities in mental health,Nature Mental Health,,,,10.1038/s44220-024-00359-2,Aaron BairdYusen Xia,2025,https://link.springer.com/article/10.1038/s44220-024-00359-2,Article
Exploring the potential of explainable AI in brain tumor detection and classification: a systematic review,Artificial Intelligence Review,,,,10.1007/s10462-025-11410-8,Lincy Annet AbrahamGopinath PalanisamyGoutham VeerapuJ. S. Nisha,2025,https://link.springer.com/article/10.1007/s10462-025-11410-8,Article
Generative artificial intelligence use in the workplace: implications for management practice,Review of Managerial Science,,,,10.1007/s11846-025-00949-z,Álvaro Hernández-TamurejoRita BužinskienėBelém BarbosaAstrida MiceikienėJose Ramon Saura,2025,https://link.springer.com/article/10.1007/s11846-025-00949-z,Article
Bias in&#xa0;Dermatological Datasets: A Critical&#xa0;Analysis&#xa0;of&#xa0;the Underrepresentation of&#xa0;Dark Skin Tones in&#xa0;Melanoma Classification Images,Computational Science – ICCS 2025 Workshops,,,,10.1007/978-3-031-97554-7_32,Tommaso RugaEster ZumpanoEugenio VocaturoLuciano CaropreseCaterina Arlia,2025,https://link.springer.com/chapter/10.1007/978-3-031-97554-7_32,Conference paper
Deep learning and machine learning techniques for head pose estimation: a survey,Artificial Intelligence Review,,,,10.1007/s10462-024-10936-7,Redhwan AlgabriAhmed AbduSungon Lee,2024,https://link.springer.com/article/10.1007/s10462-024-10936-7,Article
"Advancing biological imaging: computational techniques, AI, and bioinformatics in microscopy",Multimedia Tools and Applications,,,,10.1007/s11042-026-21396-2,Youssef  M. HassanAhmed S. MohamedYaser M. HassanAbdulrahman K. ShalabyWael M. El-Sayed,2026,https://link.springer.com/article/10.1007/s11042-026-21396-2,Article
Digital Twins and Health Care: an Umbrella Review,Journal of Medical Systems,,,,10.1007/s10916-025-02322-9,Maziar AfsharAsra MoradkhaniMarzieh SoheiliMohammadhossein TavakkolYousef MoradiHamed Gilzad Kohan,2025,https://link.springer.com/article/10.1007/s10916-025-02322-9,Article
A Comprehensive Review on Heart Disease Risk Prediction using Machine Learning and Deep Learning Algorithms,Archives of Computational Methods in Engineering,,,,10.1007/s11831-024-10194-4,Vishnu Vardhana Reddy KarnaViswavardhan Reddy KarnaVaraprasad JanamalaV. N. Koteswara Rao DevanaV. Ravi Sankar ChAravinda Babu Tummala,2024,https://link.springer.com/article/10.1007/s11831-024-10194-4,Article
Simulated misuse of large language models and clinical credit systems,npj Digital Medicine,,,,10.1038/s41746-024-01306-2,James T. AnibalHannah B. HuthJasmine GunkelSusan K. GregurickBradford J. Wood,2024,https://link.springer.com/article/10.1038/s41746-024-01306-2,Article
AI-Driven Dermatology: A Study on Skin Disease Identification Through Advanced Medical Imaging,Proceedings of International Conference on AI Systems and Sustainable Technologies,,,,10.1007/978-981-95-0629-3_25,Mayur Prakash DeshmukhRajkumar JagdaleRahul Papalkar,2026,https://link.springer.com/chapter/10.1007/978-981-95-0629-3_25,Conference paper
"The Rise of Intelligent Plastic Surgery: A 10-Year Bibliometric Journey Through AI Applications, Challenges, and Transformative Potential",Aesthetic Plastic Surgery,,,,10.1007/s00266-025-05068-4,Yi LiuKexin DengChengwu ZhangZhigen YuanJianda ZhouCan Liu,2025,https://link.springer.com/article/10.1007/s00266-025-05068-4,Article
On the role of AI in building generative urban intelligence,Artificial Intelligence Review,,,,10.1007/s10462-025-11469-3,João Carlos N. BittencourtThommas K. S. FloresThiago C. JesusDaniel G. Costa,2026,https://link.springer.com/article/10.1007/s10462-025-11469-3,Article
"Model-agnostic explainable artificial intelligence methods in finance: a systematic review, recent developments, limitations, challenges and future directions",Artificial Intelligence Review,,,,10.1007/s10462-025-11215-9,Farhina Sardar KhanSyed Shahid MazharKashif MazharDhoha A. AlSalehAmir Mazhar,2025,https://link.springer.com/article/10.1007/s10462-025-11215-9,Article
Automated segmentation of gastrointestinal organs using the TATIMPA network: a novel robust comparative deep learning approach with integrated multi-pyramidal attention,Network Modeling Analysis in Health Informatics and Bioinformatics,,,,10.1007/s13721-025-00693-0,Davinder Paul SinghTathagat BanerjeeKothapelli Punnam ChandarVijendra Singh TanwarSudhakar TummalaYogendra NarayanLakshmi Prasanna ByrapuneniRam Murat SinghPiyush CharanDebabrata Swain,2025,https://link.springer.com/article/10.1007/s13721-025-00693-0,Article
AI-Assisted Analysis of Hematological Parameters for Early Detection of Malaria,Emerging Technology and Sustainable Solutions,,,,10.1007/978-3-032-11488-4_7,RamanpreetVivek Kumar GargAttuluri Vamsi Kumar,2026,https://link.springer.com/chapter/10.1007/978-3-032-11488-4_7,Conference paper
Review on Biomedical Informatics Through the Versatility of Generative Adversarial Networks,Computational Intelligence in Data Science,,,,10.1007/978-3-031-69986-3_35,Vishvesh MukeshHrithik JoshiSparsh SarafGurwinder Singh,2024,https://link.springer.com/chapter/10.1007/978-3-031-69986-3_35,Conference paper
GenAI: a scientometric analysis of research trends using biblioshiny and VOSviewer,Discover Artificial Intelligence,,,,10.1007/s44163-025-00760-5,Kavita PabrejaReetu VermaAshok Kumar,2025,https://link.springer.com/article/10.1007/s44163-025-00760-5,Article
Integrating AI in Wearable Devices with Thermal Sensors for Breast Cancer Detection: A Review and Conceptual Framework,SN Computer Science,,,,10.1007/s42979-026-04815-x,Raniya KetfiZeina Al MasryNoureddine ZerhouniChristine Devalland,2026,https://link.springer.com/article/10.1007/s42979-026-04815-x,Article
"AI-driven techniques for detection and mitigation of SARS-CoV-2 spread: a review, taxonomy, and trends",Clinical and Experimental Medicine,,,,10.1007/s10238-025-01753-5,Mohsen GhorbianSaied GhorbianMostafa Ghobaei-Arani,2025,https://link.springer.com/article/10.1007/s10238-025-01753-5,Article
Systems Thinking Application to&#xa0;Ethical and&#xa0;Privacy Considerations in&#xa0;AI-Enabled Syndromic Surveillance Systems: Requirements for&#xa0;Under-Resourced Countries in&#xa0;Southern Africa,Pan-African Conference on Artificial Intelligence,,,,10.1007/978-3-031-57639-3_9,Taurai T. ChikotieBruce W. WatsonLiam R. Watson,2024,https://link.springer.com/chapter/10.1007/978-3-031-57639-3_9,Conference paper
Promoting transparency in AI for biomedical and behavioral research,Nature Medicine,,,,10.1038/s41591-025-03680-0,Tina Hernandez-BoussardAaron Y. LeeJulia StoyanovichLaura Biven,2025,https://link.springer.com/article/10.1038/s41591-025-03680-0,Article
A comprehensive guide to digital neurology. An update on current development on digital neurology derived from the Digital Neuro Hub project,Neurological Sciences,,,,10.1007/s10072-025-08428-9,Francesco IodiceLuca CuffaroMichele RomoliEdoardo BianchiniMaddalena SparacoAndrea ArighiChiara CeramiSimone SalemmeGiuseppe RealeIlaria OrologioLuigi LavorgnaAlessandro Padovani,2025,https://link.springer.com/article/10.1007/s10072-025-08428-9,Article
Role of Simulated Lidar Data for Training 3D Deep Learning Models: An Exhaustive Analysis,Journal of the Indian Society of Remote Sensing,,,,10.1007/s12524-024-01905-2,Bharat LohaniParvej KhanVaibhav KumarSiddhartha Gupta,2024,https://link.springer.com/article/10.1007/s12524-024-01905-2,Article
Algorithmic fairness datasets: the story so far,Data Mining and Knowledge Discovery,,,,10.1007/s10618-022-00854-z,Alessandro FabrisStefano MessinaGianmaria SilvelloGian Antonio Susto,2022,https://link.springer.com/article/10.1007/s10618-022-00854-z,Article
GenAI in Public Sector Transformation: Balancing Promise and Prudence,Electronic Government and the Information Systems Perspective,,,,10.1007/978-3-032-02225-7_8,Gideon Mekonnen JonathanShengnan Han,2026,https://link.springer.com/chapter/10.1007/978-3-032-02225-7_8,Conference paper
The Role of AI in Modern Data Engineering: Automating ETL and Beyond,ICT for Global Innovations and Solutions,,,,10.1007/978-3-032-02853-2_47,Janardhan Reddy Kasireddy,2026,https://link.springer.com/chapter/10.1007/978-3-032-02853-2_47,Conference paper
Advancing health equity with artificial intelligence,Journal of Public Health Policy,,,,10.1057/s41271-021-00319-5,Nicole M. ThomasianCarsten EickhoffEli Y. Adashi,2021,https://link.springer.com/article/10.1057/s41271-021-00319-5,Article
"Deep learning applications in the Internet of Things: a review, tools, and future directions",Evolutionary Intelligence,,,,10.1007/s12065-024-00949-0,Parisa RaoufiAtefeh HemmatiAmir Masoud Rahmani,2024,https://link.springer.com/article/10.1007/s12065-024-00949-0,Article
Social determinants of health extraction from clinical notes across institutions using large language models,npj Digital Medicine,,,,10.1038/s41746-025-01645-8,Vipina K. KelothSalih SelekQingyu ChenChristopher GilmanSunyang FuYifang DangXinghan ChenXinyue HuYujia ZhouHuan HeJungwei W. FanKaren WangCynthia BrandtCui TaoHongfang LiuHua Xu,2025,https://link.springer.com/article/10.1038/s41746-025-01645-8,Article
Fostering trust and interpretability in skin cancer classification: a hybrid framework of deep learning and machine learning with explainable AI,Journal of Ambient Intelligence and Humanized Computing,,,,10.1007/s12652-025-04984-2,Aurora Lithe RoyAbdullah Al MarufRayhanul Islam SonyArghya Pranto RoyNuzhat Noor Islam ProvaZeyar Aung,2025,https://link.springer.com/article/10.1007/s12652-025-04984-2,Article
Toward Resilient AI in Medical Imaging: Handling and Mining Multiple Sources of Data,SN Computer Science,,,,10.1007/s42979-026-04821-z,Michela GravinaAdriano De SimoneGiuseppe PontilloZeena ShawaStefano MarroneRoberta FuscoVincenza GranataAntonella PetrilloJames H. ColeMario SansoneCarlo Sansone,2026,https://link.springer.com/article/10.1007/s42979-026-04821-z,Article
"Strengths, weaknesses, opportunities, and threats of using AI-enabled technology in sleep medicine: a commentary",Journal of Clinical Sleep Medicine,,,,10.5664/jcsm.11132,Anuja BandyopadhyayMargarita OksHaoqi SunBharati PrasadSam RuskFelicia JeffersonRoneil Gopal MalkaniShahab HaghayeghRamesh SachdevaDennis HwangJon AgustssonEmmanuel MignotMichael SummersDaniel FabbriMaryann DeakMatthew AnastasiAndrew SampsonSteve Van HoutAzizi Seixas,2024,https://link.springer.com/article/10.5664/jcsm.11132,Article
Uncovering ethical biases in publicly available fetal ultrasound datasets,npj Digital Medicine,,,,10.1038/s41746-025-01739-3,Maria Chiara FiorentinoSara MocciaMariachiara Di CosmoEmanuele FrontoniBenedetta GiovanolaSimona Tiribelli,2025,https://link.springer.com/article/10.1038/s41746-025-01739-3,Article
Guidance on selecting and evaluating AI auto-segmentation systems in clinical radiotherapy: insights from a six-vendor analysis,Physical and Engineering Sciences in Medicine,,,,10.1007/s13246-024-01513-x,Branimir RusanovMartin A. EbertMahsheed SabetPejman RowshanfarzadNathaniel BarryJake KendrickZaid AlkhatibSuki GillJoshua DassNicholas BucknellJeremy CrokerColin TangRohen WhiteSean BydderMandy TaylorLuke SlamaGodfrey Mukwada,2025,https://link.springer.com/article/10.1007/s13246-024-01513-x,Article
"Navigating the AI Frontier in Toxicology: Trends, Trust, and Transformation",Current Environmental Health Reports,,,,10.1007/s40572-025-00514-6,Thomas LuechtefeldThomas Hartung,2025,https://link.springer.com/article/10.1007/s40572-025-00514-6,Article
Mitigating AI Bias in Postpartum Depression Care with Dual-Stage Framework for Equitable and Personalized Mental Health Support,Proceedings of Data Analytics and Management,,,,10.1007/978-3-032-02831-0_33,Sonia Maria D’SouzaT. S. YazhiniR. ShankarP. Kaviya ShriSahana RaviS. Sumehra Banu,2026,https://link.springer.com/chapter/10.1007/978-3-032-02831-0_33,Conference paper
"Unleashing the power of untuned large language models in recommender systems: a thorough investigation of current approaches, challenges, and future research directions",Knowledge and Information Systems,,,,10.1007/s10115-025-02539-7,Muniraja PasupuletiShashank Mouli Satapathy,2025,https://link.springer.com/article/10.1007/s10115-025-02539-7,Article
Artificial intelligence (AI) cybersecurity dimensions: a comprehensive framework for understanding adversarial and offensive AI,AI and Ethics,,,,10.1007/s43681-024-00427-4,Masike MalatjiAlaa Tolah,2024,https://link.springer.com/article/10.1007/s43681-024-00427-4,Article
"Curriculum check, 2025—equipping radiology residents for AI challenges of tomorrow",Abdominal Radiology,,,,10.1007/s00261-025-05016-5,Vasantha Kumar VenugopalAmit KumarMin On TanGilberto Szarf,2025,https://link.springer.com/article/10.1007/s00261-025-05016-5,Article
"A Critical Analysis of Generative AI: Challenges, Opportunities, and Future Research Directions",Archives of Computational Methods in Engineering,,,,10.1007/s11831-025-10355-z,Mueen UddinShams Ul ArfeenFuhid AlanaziSaddam HussainTehseen MazharMd. Arafatur Rahman,2025,https://link.springer.com/article/10.1007/s11831-025-10355-z,Article
"Deep learning based computer aided diagnosis of Alzheimer’s disease: a snapshot of last 5 years, gaps, and future directions",Artificial Intelligence Review,,,,10.1007/s10462-023-10644-8,Anish BhandarkarPratham NaikKavita VakkundSrasthi JunjappanavarSavita BakareSantosh Pattar,2024,https://link.springer.com/article/10.1007/s10462-023-10644-8,Article
"Integrating artificial intelligence in industry 4.0: insights, challenges, and future prospects–a literature review",Annals of Operations Research,,,,10.1007/s10479-024-06012-6,Abd El Hedi Gabsi,2024,https://link.springer.com/article/10.1007/s10479-024-06012-6,Article
Convolutional neural network algorithms in diabetic retinopathy: how far does it go?,Artificial Intelligence Review,,,,10.1007/s10462-025-11453-x,Zhanchi HuJie JiJian-Wei LinChi XiaoLing-Ping Cen,2025,https://link.springer.com/article/10.1007/s10462-025-11453-x,Article
Medical Imaging Data Strategies for Catalyzing AI Medical Device Innovation,Journal of Imaging Informatics in Medicine,,,,10.1007/s10278-024-01374-6,Ravi  K. SamalaBrandon  D. GallasGhada ZamzmiKrishna JuluruAmir KhanCatherine BahrRobert OchsDorn CarranzaJason GranstedtEdward MargerrisonAldo Badano,2025,https://link.springer.com/article/10.1007/s10278-024-01374-6,Article
"Generative models of MRI-derived neuroimaging features and associated dataset of 18,000 samples",Scientific Data,,,,10.1038/s41597-024-04157-4,Sai Spandana ChintapalliRongguang WangZhijian YangVasiliki TassopoulouFanyang YuVishnu BashyamGuray ErusPratik ChaudhariHaochang ShouChristos Davatzikos,2024,https://link.springer.com/article/10.1038/s41597-024-04157-4,Article
AI Models and AI Algorithms. The History of Innovation Society to Shape the Future,Trends in Sustainable Computing and Machine Intelligence,,,,10.1007/978-981-96-1452-3_34,Paula CobzaruAlexandru Țugui,2025,https://link.springer.com/chapter/10.1007/978-981-96-1452-3_34,Conference paper
Review of generative AI for lesion localization and automatic report generation,Med-X,,,,10.1007/s44258-026-00076-8,Kaicong SunYulin WangShijie HuangYuxiao LiuHaoyuan ChenZifeng LianMinhui TanXin LinWeilin ZhouZhaoyu QiuXiaoye LiMingyang YuDinggang Shen,2026,https://link.springer.com/article/10.1007/s44258-026-00076-8,Article
"AI and medical imaging technology: evolution, impacts, and economic insights",The Journal of Technology Transfer,,,,10.1007/s10961-024-10100-x,Emefa Surprize Deborah BuakaMd Zubab Ibne Moid,2024,https://link.springer.com/article/10.1007/s10961-024-10100-x,Article
"Designing an ethical and explainable automatic coaching (eCoach) system for community based, persuasive recommendations",Multimedia Tools and Applications,,,,10.1007/s11042-025-21116-2,Ayan ChatterjeeMichael A. RieglerPål Halvorsen,2025,https://link.springer.com/article/10.1007/s11042-025-21116-2,Article
Leveraging XGBoost and explainable AI for accurate prediction of type 2 diabetes,BMC Public Health,,,,10.1186/s12889-025-24953-w,Zahra RafieMoslem Sedaghat TalabBehrooz Ebrahim Zadeh KoorAli GaravandCirruse SalehnasabMustafa Ghaderzadeh,2025,https://link.springer.com/article/10.1186/s12889-025-24953-w,Article
Towards Ethical Foundation Models in Robotics: Challenges and Proposals,Crisis or Redemption with AI and Robotics? The Dawn of a New Era,,,,10.1007/978-3-032-00261-7_2,Ergina Kavallieratou,2026,https://link.springer.com/chapter/10.1007/978-3-032-00261-7_2,Conference paper
A comprehensive review of product recommendation systems using deep learning techniques,Knowledge and Information Systems,,,,10.1007/s10115-025-02667-0,Ritu RajalNishant KumarSanjeev KumarMahfooz Alam,2025,https://link.springer.com/article/10.1007/s10115-025-02667-0,Article
Realistic morphology-preserving generative modelling of the brain,Nature Machine Intelligence,,,,10.1038/s42256-024-00864-0,Petru-Daniel TudosiuWalter H. L. PinayaPedro Ferreira Da CostaJessica DafflonAshay PatelPedro BorgesVirginia FernandezMark S. GrahamRobert J. GrayParashkev NachevSebastien OurselinM. Jorge Cardoso,2024,https://link.springer.com/article/10.1038/s42256-024-00864-0,Article
Multimodal approaches and AI-driven innovations in dementia diagnosis: a systematic review,Discover Artificial Intelligence,,,,10.1007/s44163-025-00358-x,Revati M. WahulSarita AmbadekarDeepesh M. DhanvijayMrinai M. DhanvijayManisha A. DudhediaVarsha GaikwadBhavana KanawadeJ. R. PansareBalaji BodkheS. H. Gawande,2025,https://link.springer.com/article/10.1007/s44163-025-00358-x,Article
Clinically informed semi-supervised learning improves disease annotation and equity from electronic health records: a glaucoma case study,npj Digital Medicine,,,,10.1038/s41746-025-02267-w,Mousa MoradiRishi ShahAsahi FujitaNiloufar BineshfarDaniel M. VuKanza AzizDaniel L. LiebmanSaber Kazeminasab HashemabadMengyu WangTobias ElzeMohammad EslamiNazlee Zebardast,2025,https://link.springer.com/article/10.1038/s41746-025-02267-w,Article
From data to diagnosis: a systematic review on AI-driven approaches to diabetes prediction,Artificial Intelligence Review,,,,10.1007/s10462-025-11485-3,Saleha MasoodMousa Ahmad Al-BashrawiMuhammad Attique KhanYogesh K. Dwivedi,2026,https://link.springer.com/article/10.1007/s10462-025-11485-3,Article
Integration of metaheuristic and machine learning in Cloud-Fog-Edge IoMT applications: a survey,Cluster Computing,,,,10.1007/s10586-025-05442-6,Zahia LalamaLakhdar GoudjilSarra CherbalLemia Louail,2025,https://link.springer.com/article/10.1007/s10586-025-05442-6,Article
Artificial neural networks fighting real neural decline: a systematic review of AI in Alzheimer’s research,Artificial Intelligence Review,,,,10.1007/s10462-025-11484-4,Farzana Sharmin MouTanvir AhmedMd Nazmul HudaAsoke K. Nandi,2026,https://link.springer.com/article/10.1007/s10462-025-11484-4,Article
Deep Learning Approaches in EEG Analysis for Early Detection of Alzheimer’s Disease and Mild Cognitive Impairment: A Mini Systematic Review,Applied Intelligence and Informatics,,,,10.1007/978-3-032-04657-4_5,Tahoura MorovatiHamed VaeziSepehr KarimiMufti MahmudMark Crook-RumseyNadja HeymDavid J. BrownAlex Sumich,2025,https://link.springer.com/chapter/10.1007/978-3-032-04657-4_5,Conference paper
Large language models in radiogenomics: a comprehensive survey of applications from imaging to genetics,The Visual Computer,,,,10.1007/s00371-026-04385-2,Muhammad Nadeem CheemaAnam NazirArif HarmanciAkdes Serin HarmanciYasmeen CheemaSaleha MasoodFahad Ahmed Khokhar,2026,https://link.springer.com/article/10.1007/s00371-026-04385-2,Article
Design and Early Implementation of PRÆVIDA: A Predictive Hospital-Based Technovigilance System,XLVIII Mexican Conference on Biomedical Engineering,,,,10.1007/978-3-032-13729-6_6,González Campos EdgarGuerrero Piña RicardoDel Valle Olaya Karen,2026,https://link.springer.com/chapter/10.1007/978-3-032-13729-6_6,Conference paper
